How to know whether we are having corona virus,The most common symptoms of COVID-19 are fever tiredness and dry  cough.  Some  patients  may  have  aches  and  pains nasal congestion runny nose sore throat or diarrhea. These symptoms are usually mild and begin gradually. Some people become infected but don?t  develop  any  symptoms  and  don't  feel  unwell.  Most  people (about  80%)  recover  from  the  disease  without  needing  special treatment.  Around  1  out  of  every  6  people  who  gets COVID-19 becomes seriously ill and develops difficulty breathing. Older people and those with underlying medical problems like high blood pressure heart problems or diabetes are more likely to develop serious illness. People with fever cough and difficulty breathing should seek medical attention.
How to know whether we are having covid-19,The most common symptoms of COVID-19 are fever tiredness and dry  cough.  Some  patients  may  have  aches  and  pains nasal congestion runny nose sore throat or diarrhea. These symptoms are usually mild and begin gradually. Some people become infected but don?t  develop  any  symptoms  and  don't  feel  unwell.  Most  people (about  80%)  recover  from  the  disease  without  needing  special treatment.  Around  1  out  of  every  6  people  who  gets COVID-19 becomes seriously ill and develops difficulty breathing. Older people and those with underlying medical problems like high blood pressure heart problems or diabetes are more likely to develop serious illness. People with fever cough and difficulty breathing should seek medical attention.
what to do to protect ourselves from this virus,Keep youself and surrouding clean. Please stay at home!
How many days for the end of Corona virus,It will be very soon ended if we all support each other in this fight
In how many days will covid-19 be ended,It will be very soon ended if we all support each other in this fight
will covid-19 end,It will be very soon ended if we all support each other in this fight
when covid will stop spreading,It will be very soon ended if we all support each other in this fight
When will corona virus gets stopped from spreading,It will be very soon ended if we all support each other in this fight
When covid-19 will stop spreading,It will be very soon ended if we all support each other in this fight
Is covid-19 originated from lab testing,COVID-19  is  the  infectious  disease  caused  by  the  most  recently  discovered  corona  virus. This  new  virus  and  disease  were  unknown  before the outbreak began in Wuhan China in December 2019.
Is covid-19 air borne?,Studies to date suggest that the virus that causes COVID-19 is mainly transmitted  through  contact  with  respiratory  droplets  rather  than through  the  air.   See  previous  answer  on  ?How  does COVID-19 spread??
How many days more it will take for the virus to end,It will be very soon ended if we all support each other in this fight
How many days lockdown period will be there,It will be very soon ended if we all support each other in this fight
what is lockdown,a state of isolation or restricted access instituted as a security measure.
what happens with lockdown,"We cannot completely wipe out virus, but, we can stop it spreading more."
Is lockdown necessary,"We cannot completely wipe out virus, but, we can stop it spreading more."
How lockdown is beneficial,"We cannot completely wipe out virus, but, we can stop it spreading more."
what else do you know,I'm here to provide information on covid-19 statistics country-wise and state-wise
what else do you do,I'm here to provide information on covid-19 statistics country-wise and state-wise
what is WHO,The World Health Organization is a specialized agency of the United Nations responsible for international public health
symptoms of corona virus,The most common symptoms of COVID-19 are fever tiredness and dry  cough.  Some  patients  may  have  aches  and  pains nasal congestion runny nose sore throat or diarrhea. These symptoms are usually mild and begin gradually. Some people become infected but don?t  develop  any  symptoms  and  don't  feel  unwell.  Most  people (about  80%)  recover  from  the  disease  without  needing  special treatment.  Around  1  out  of  every  6  people  who  gets COVID-19 becomes seriously ill and develops difficulty breathing. Older people and those with underlying medical problems like high blood pressure heart problems or diabetes are more likely to develop serious illness. People with fever cough and difficulty breathing should seek medical attention.
Incubation period of corona virus,"The  incubation  period  means  the  time  between  catching  the  virus and  beginning  to  have  symptoms  of  the  disease.  Most  estimates  of the  incubation  period  for  COVID-19  range  from  1-14 days  most commonly around five days. These estimates will be updated as more data become available.
To protect yourself such as when visiting live animal markets avoid direct  contact  with  animals  and  surfaces  in  contact  with  animals. Ensure good food safety practices at all times. Handle raw meat milk or animal organs with care to avoid contamination of uncooked foods and avoid consuming raw or undercooked animal products."
Incubation period of covid-19,"The  incubation  period  means  the  time  between  catching  the  virus and  beginning  to  have  symptoms  of  the  disease.  Most  estimates  of the  incubation  period  for  COVID-19  range  from  1-14 days  most commonly around five days. These estimates will be updated as more data become available.
To protect yourself such as when visiting live animal markets avoid direct  contact  with  animals  and  surfaces  in  contact  with  animals. Ensure good food safety practices at all times. Handle raw meat milk or animal organs with care to avoid contamination of uncooked foods and avoid consuming raw or undercooked animal products."
will this virus end,It will be very soon ended if we all support each other in this fight
end of corona virus,It will be very soon ended if we all support each other in this fight
end of covid-19,It will be very soon ended if we all support each other in this fight
How corona virus will stop from spreading,It will be very soon ended if we all support each other in this fight
spreading of covid-19,People  can  catch  COVID-19  from  others  who  have  the virus.  The  disease can spread from person to person through small droplets from  the nose or mouth which are spread when a person  with COVID-19 coughs  or  exhales.  These  droplets  land  on  objects  and  surfaces  around  the  person.  Other  people  then  catch  COVID-19  by  touching  these  objects  or  surfaces  then  touching  their  eyes  nose  or  mouth.  People  can  also  catch  COVID-19  if  they  breathe  in  droplets  from  a  person  with  COVID-19  who  coughs  out  or  exhales  droplets.  This  is  why  it  is  important  to  stay  more  than  1  meter  (3  feet)  away  from  a  person who is sick.
Will I be tested positive even if i dont have any symptoms,Reports suggest that there are few cases without symptoms
covid-19 without symptoms,Reports suggest that there are few cases without symptoms
corona virus wihtout symptoms,Reports suggest that there are few cases without symptoms
how corona virus started,The origin story of coronavirus seems well fixed: in late 2019 someone at the now world-famous Huanan seafood market in Wuhan was infected with a virus from an animal.
how corona virus formed,The origin story of coronavirus seems well fixed: in late 2019 someone at the now world-famous Huanan seafood market in Wuhan was infected with a virus from an animal.
how corona virus detected,The origin story of coronavirus seems well fixed: in late 2019 someone at the now world-famous Huanan seafood market in Wuhan was infected with a virus from an animal.
how covid-19 started,The origin story of coronavirus seems well fixed: in late 2019 someone at the now world-famous Huanan seafood market in Wuhan was infected with a virus from an animal.
how covid-19 formed,The origin story of coronavirus seems well fixed: in late 2019 someone at the now world-famous Huanan seafood market in Wuhan was infected with a virus from an animal.
how covid-19 detected,The origin story of coronavirus seems well fixed: in late 2019 someone at the now world-famous Huanan seafood market in Wuhan was infected with a virus from an animal.
How long does the coronavirus last on surfaces?,"It is not certain how long the virus that causes COVID-19 survives on surfaces, but it seems to behave like other coronaviruses. Studies suggest that coronaviruses (including preliminary information on the COVID-19 virus) may persist on surfaces for a few hours or up to several days."
Is coughing a symptom of the coronavirus disease?,"The most common symptoms of COVID-19 are fever, tiredness, and dry cough. Some patients may have aches and pains, nasal congestion, runny nose, sore throat or diarrhea. These symptoms are usually mild and begin gradually."
Can babies get the coronavirus disease?,"We know it is possible for people of any age to be infected with the virus, but so far there are relatively few cases of COVID-19 reported among children."
Is the coronavirus disease new?,Coronavirus disease (COVID-19) is a new strain that was discovered in 2019 and has not been previously identified in humans.
What happens when you get the coronavirus disease?,"People with COVID-19 generally develop signs and symptoms, including mild respiratory symptoms and fever, on an average of 5-6 days after infection (mean incubation period 5-6 days, range 1-14 days). Most people infected with COVID-19 virus have mild disease and recover."
Can the coronavirus disease spread through air?,"The virus that causes COVID-19 is mainly transmitted through droplets generated when an infected person coughs, sneezes, or speaks. These droplets are too heavy to hang in the air. They quickly fall on floors or surfaces. You can be infected by breathing in the virus if you are within 1 metre of a person who has COVID-19, or by touching a contaminated surface and then touching your eyes, nose or mouth before washing your hands."
How severe is the coronavirus disease?,"Most people infected with the COVID-19 virus will experience mild to moderate respiratory illness and recover without requiring special treatment. Older people, and those with underlying medical problems like cardiovascular disease, diabetes, chronic respiratory disease, and cancer are more likely to develop serious illness."
What is the official name of the coronavirus disease?,ICTV announced “severe acute respiratory syndrome coronavirus 2 (SARS-CoV-2)” as the name of the new virus on 11 February 2020
Can cold weather and snow prevent the coronavirus disease?,There is no reason to believe that cold weather can kill the new coronavirus or other diseases.
will corona virus be killed in summer,There is no reason to believe that  weather can kill the new coronavirus or other diseases.
will covid-19 get killed in summer,There is no reason to believe that  weather can kill the new coronavirus or other diseases.
What nutrition guidance should I follow during the coronavirus disease outbreak?,"Proper nutrition and hydration are vital. People who eat a well-balanced diet tend to be healthier with stronger immune systems and lower risk of chronic illnesses and infectious diseases. So you should eat a variety of fresh and unprocessed foods every day to get the vitamins, minerals, dietary fibre, protein and antioxidants your body needs. Drink enough water."
diet during this period,"Proper nutrition and hydration are vital. People who eat a well-balanced diet tend to be healthier with stronger immune systems and lower risk of chronic illnesses and infectious diseases. So you should eat a variety of fresh and unprocessed foods every day to get the vitamins, minerals, dietary fibre, protein and antioxidants your body needs. Drink enough water."
diet of corona virus,"Proper nutrition and hydration are vital. People who eat a well-balanced diet tend to be healthier with stronger immune systems and lower risk of chronic illnesses and infectious diseases. So you should eat a variety of fresh and unprocessed foods every day to get the vitamins, minerals, dietary fibre, protein and antioxidants your body needs. Drink enough water."
diet of covid-19,"Proper nutrition and hydration are vital. People who eat a well-balanced diet tend to be healthier with stronger immune systems and lower risk of chronic illnesses and infectious diseases. So you should eat a variety of fresh and unprocessed foods every day to get the vitamins, minerals, dietary fibre, protein and antioxidants your body needs. Drink enough water."
Who is Praneeth,Sorry!I'm here to provide statistics on covid-19 cases country-wise and state-wise!Please ask related to it
